{
  "schemaVersion": 1,
  "academicYear": 2026,
  "timezone": "Asia/Tokyo",
  "source": [
    {
      "id": "official-graduate-2026-2q",
      "title": "Science Tokyo 2026 2Q Graduate final-exam timetable",
      "url": "https://www.titech.ac.jp/student/pdf/life-graduate-exam-timetable.pdf",
      "landingPageUrl": "https://www.titech.ac.jp/student/students/life/graduate-exam",
      "retrievedAt": "2026-10-18T08:39:26Z",
      "sha256": "61bba1126741cae100c947132d3bc57286dbe4a2a457bc723a56da3b6a83443d",
      "publishedAt": "2026-07-21"
    }
  ],
  "entries": [
    {
      "id": "2026-2Q-graduate-LAH.S434-class-2026-07-29-1",
      "kind": "class",
      "status": "scheduled",
      "quarter": "2Q",
      "courseCode": "LAH.S434",
      "date": "2026-07-29",
      "periods": [
        1,
        2
      ],
      "room": {
        "ja": "J2-203"
      },
      "label": {
        "ja": "文系エッセンス３８：統計学",
        "en": "Essence of Humanities and Social Sciences38:Statistics"
      },
      "sourceIds": [
        "official-graduate-2026-2q"
      ],
      "sourcePages": [
        1
      ]
    },
    {
      "id": "2026-2Q-graduate-LAJ.J403-01-class-2026-07-29-1",
      "kind": "class",
      "status": "scheduled",
      "quarter": "2Q",
      "courseCode": "LAJ.J403-01",
      "date": "2026-07-29",
      "periods": [
        1,
        4
      ],
      "room": {
        "ja": "W1-109"
      },
      "label": {
        "ja": "日本語研修コースA２(集中コース) 2QA",
        "en": "Intensive Japanese Course A2 2QA"
      },
      "sourceIds": [
        "official-graduate-2026-2q"
      ],
      "sourcePages": [
        1
      ]
    },
    {
      "id": "2026-2Q-graduate-LAH.A503-class-2026-07-29-3",
      "kind": "class",
      "status": "scheduled",
      "quarter": "2Q",
      "courseCode": "LAH.A503",
      "date": "2026-07-29",
      "periods": [
        3,
        4
      ],
      "room": {
        "ja": "J2-203"
      },
      "label": {
        "ja": "世界を知る：中南米",
        "en": "Area Studies: Latin America"
      },
      "sourceIds": [
        "official-graduate-2026-2q"
      ],
      "sourcePages": [
        1
      ]
    },
    {
      "id": "2026-2Q-graduate-LAH.S420-01-class-2026-07-29-3",
      "kind": "class",
      "status": "scheduled",
      "quarter": "2Q",
      "courseCode": "LAH.S420-01",
      "date": "2026-07-29",
      "periods": [
        3,
        4
      ],
      "room": {
        "ja": "G2-202"
      },
      "label": {
        "ja": "文系エッセンス２０：西洋思想 1",
        "en": "Essence of Humanities and Social Sciences20:Western Thought 1"
      },
      "sourceIds": [
        "official-graduate-2026-2q"
      ],
      "sourcePages": [
        1
      ]
    },
    {
      "id": "2026-2Q-graduate-LAH.T423-class-2026-07-29-3",
      "kind": "class",
      "status": "scheduled",
      "quarter": "2Q",
      "courseCode": "LAH.T423",
      "date": "2026-07-29",
      "periods": [
        3,
        4
      ],
      "room": {
        "ja": "ハイフレックス配信(Held by HyFlex)"
      },
      "label": {
        "ja": "横断科目２３：Science Tokyoのキャンパスに親 しむ",
        "en": "Transdisciplinary studies 23:Getting familiar with Science Tokyo campuses"
      },
      "sourceIds": [
        "official-graduate-2026-2q"
      ],
      "sourcePages": [
        1
      ]
    },
    {
      "id": "2026-2Q-graduate-LAL.S432-class-2026-07-29-5",
      "kind": "class",
      "status": "scheduled",
      "quarter": "2Q",
      "courseCode": "LAL.S432",
      "date": "2026-07-29",
      "periods": [
        5,
        6
      ],
      "room": {
        "ja": "M-155"
      },
      "label": {
        "ja": "スペイン語文化演習２",
        "en": "Spanish Seminar: Culture and Society 2"
      },
      "sourceIds": [
        "official-graduate-2026-2q"
      ],
      "sourcePages": [
        1
      ]
    },
    {
      "id": "2026-2Q-graduate-SHS.P442-class-2026-07-29-5",
      "kind": "class",
      "status": "scheduled",
      "quarter": "2Q",
      "courseCode": "SHS.P442",
      "date": "2026-07-29",
      "periods": [
        5,
        6
      ],
      "room": {
        "ja": "W9-201"
      },
      "label": {
        "ja": "政治・法律・行政分野特論S1B",
        "en": "Graduate Lecture in Politics, Law and Administration S1B"
      },
      "sourceIds": [
        "official-graduate-2026-2q"
      ],
      "sourcePages": [
        1
      ]
    },
    {
      "id": "2026-2Q-graduate-LST.A503-class-2026-07-31-1",
      "kind": "class",
      "status": "scheduled",
      "quarter": "2Q",
      "courseCode": "LST.A503",
      "date": "2026-07-31",
      "periods": [
        1,
        2
      ],
      "room": {
        "ja": "ZOOM"
      },
      "label": {
        "ja": "環境微生物学",
        "en": "Environmental Microbiology"
      },
      "sourceIds": [
        "official-graduate-2026-2q"
      ],
      "sourcePages": [
        2
      ]
    },
    {
      "id": "2026-2Q-graduate-LAJ.J403-01-class-2026-07-31-1",
      "kind": "class",
      "status": "scheduled",
      "quarter": "2Q",
      "courseCode": "LAJ.J403-01",
      "date": "2026-07-31",
      "periods": [
        1,
        4
      ],
      "room": {
        "ja": "W1-102"
      },
      "label": {
        "ja": "日本語研修コースA２(集中コース) 2QA",
        "en": "Intensive Japanese Course A2 2QA"
      },
      "sourceIds": [
        "official-graduate-2026-2q"
      ],
      "sourcePages": [
        2
      ]
    },
    {
      "id": "2026-2Q-graduate-PHY.C454-class-2026-07-31-1",
      "kind": "class",
      "status": "scheduled",
      "quarter": "2Q",
      "courseCode": "PHY.C454",
      "date": "2026-07-31",
      "periods": [
        1,
        4
      ],
      "room": {
        "ja": "M-102"
      },
      "label": {
        "ja": "光と物質 IV",
        "en": "Light and Matter IV"
      },
      "sourceIds": [
        "official-graduate-2026-2q"
      ],
      "sourcePages": [
        2
      ]
    },
    {
      "id": "2026-2Q-graduate-ICT.S407-class-2026-07-31-3",
      "kind": "class",
      "status": "scheduled",
      "quarter": "2Q",
      "courseCode": "ICT.S407",
      "date": "2026-07-31",
      "periods": [
        3,
        4
      ],
      "room": {
        "ja": "S3-215"
      },
      "label": {
        "ja": "無線信号処理",
        "en": "Wireless Signal Processing"
      },
      "sourceIds": [
        "official-graduate-2026-2q"
      ],
      "sourcePages": [
        2
      ]
    },
    {
      "id": "2026-2Q-graduate-LST.A404-class-2026-07-31-3",
      "kind": "class",
      "status": "scheduled",
      "quarter": "2Q",
      "courseCode": "LST.A404",
      "date": "2026-07-31",
      "periods": [
        3,
        4
      ],
      "room": {
        "ja": "オンラインOnline"
      },
      "label": {
        "ja": "分子生理学",
        "en": "Cell Physiology"
      },
      "sourceIds": [
        "official-graduate-2026-2q"
      ],
      "sourcePages": [
        2
      ]
    },
    {
      "id": "2026-2Q-graduate-MAT.M436-class-2026-07-31-3",
      "kind": "class",
      "status": "scheduled",
      "quarter": "2Q",
      "courseCode": "MAT.M436",
      "date": "2026-07-31",
      "periods": [
        3,
        4
      ],
      "room": {
        "ja": "J2-302"
      },
      "label": {
        "ja": "高温材料強度学",
        "en": "High-Temperature Strength of Metallic Materials"
      },
      "sourceIds": [
        "official-graduate-2026-2q"
      ],
      "sourcePages": [
        2
      ]
    },
    {
      "id": "2026-2Q-graduate-MCS.M431-class-2026-07-31-3",
      "kind": "class",
      "status": "scheduled",
      "quarter": "2Q",
      "courseCode": "MCS.M431",
      "date": "2026-07-31",
      "periods": [
        3,
        4
      ],
      "room": {
        "ja": "M-B107"
      },
      "label": {
        "ja": "非線形拡散方程式",
        "en": "Nonlinear Diffusion Equations"
      },
      "sourceIds": [
        "official-graduate-2026-2q"
      ],
      "sourcePages": [
        2
      ]
    },
    {
      "id": "2026-2Q-graduate-ART.T553-class-2026-07-31-5",
      "kind": "class",
      "status": "scheduled",
      "quarter": "2Q",
      "courseCode": "ART.T553",
      "date": "2026-07-31",
      "periods": [
        5,
        6
      ],
      "room": {
        "ja": "M-134"
      },
      "label": {
        "ja": "メディカル・ヘルスケアインフォマティクス",
        "en": "Medical and Health Informatics"
      },
      "sourceIds": [
        "official-graduate-2026-2q"
      ],
      "sourcePages": [
        2
      ]
    },
    {
      "id": "2026-2Q-graduate-MTH.B402-class-2026-07-31-5",
      "kind": "class",
      "status": "scheduled",
      "quarter": "2Q",
      "courseCode": "MTH.B402",
      "date": "2026-07-31",
      "periods": [
        5,
        6
      ],
      "room": {
        "ja": "W5-105"
      },
      "label": {
        "ja": "幾何学特論B",
        "en": "Advanced topics in Geometry B"
      },
      "sourceIds": [
        "official-graduate-2026-2q"
      ],
      "sourcePages": [
        2
      ]
    },
    {
      "id": "2026-2Q-graduate-ARC.P421-class-2026-07-31-5",
      "kind": "class",
      "status": "scheduled",
      "quarter": "2Q",
      "courseCode": "ARC.P421",
      "date": "2026-07-31",
      "periods": [
        5,
        8
      ],
      "room": {
        "ja": "M-135"
      },
      "label": {
        "ja": "施設計画学特論第一",
        "en": "Theories in Facility Planning I"
      },
      "sourceIds": [
        "official-graduate-2026-2q"
      ],
      "sourcePages": [
        2
      ]
    },
    {
      "id": "2026-2Q-graduate-ARC.S424-class-2026-07-31-7",
      "kind": "class",
      "status": "scheduled",
      "quarter": "2Q",
      "courseCode": "ARC.S424",
      "date": "2026-07-31",
      "periods": [
        7,
        8
      ],
      "room": {
        "ja": "W5-104"
      },
      "label": {
        "ja": "地盤地震工学特論",
        "en": "Advanced Geometrical Engineering"
      },
      "sourceIds": [
        "official-graduate-2026-2q"
      ],
      "sourcePages": [
        2
      ]
    },